{
  "id": "iris",
  "display_name": "Iris",
  "role": "Student volunteer on the archive digitisation project.",
  "asset_id": "pm_a01_kohaku",
  "romanceable": true,
  "tags": [
    "archive",
    "photography",
    "memory"
  ],
  "notes": "Perspective: evidence as feeling. She trusts photographs more than people, which is not the same as trusting them correctly."
}
