{
  "id": "june",
  "display_name": "June",
  "role": "Student, transferred in two years ago.",
  "asset_id": "pm_a01_kanako",
  "romanceable": true,
  "tags": [
    "skeptic"
  ],
  "notes": "Perspective: wants this to be nothing, and has good reasons for wanting that which are not about the archive at all."
}
